{"candidate_count": 1, "candidates": [{"classification": "candidate_contradiction", "edit": null, "evidence_refs": ["service.qwen3-tts.gpu-ordinal"], "hunk_id": "hunk-1-b3e991945e02", "id": "cand-qwen3-tts-gpu-ordinal", "reason": "evidence_conflict", "source": {"quote": "\n```yaml\nqwen3_tts_vllm_image: \"vllm/vllm-omni:v0.28.0\"\nqwen3_tts_gpu_ordinal: 2\nqwen3_tts_port: 8100\nqwen3_tts_min_free_vram_mib: 512\n```", "span_id": "span-1-55b3a7cd3daa"}}], "change_type": "M", "document_path": "docs/designs/qwen3-tts-openai-api-integration.md", "kind": "candidate_discovery_result", "manifest_sha256": "7488050a65e74380ba7dafd351932cbfd339c1c99a4359db928dd38863d1cc87", "previous_path": null, "reason": "analysis_completed", "revision": {"base": "982fa7794529fc41414d699a3615e4e4f4327c3b", "head": "3afb1dfcc14dabe6a16323d91913637f85dbf6b9"}, "run_record_sha256": "eae5b5316058a245b5e87dcb96369342115270eb4fa2b6fffa36a68a12c755d3", "schema_version": 2, "status": "completed"}