{
  "candidate_count": 1,
  "candidates": [
    {
      "classification": "candidate_contradiction",
      "edit": null,
      "evidence_refs": [
        "service.netbox.port"
      ],
      "hunk_id": "hunk-1-650f641ea10e",
      "id": "cand-1-netbox-port",
      "reason": "evidence_conflict",
      "source": {
        "quote": "|----------|---------|-------------|\n| `netbox_git_version` | `\"3.0.2\"` | netbox-docker version (controls docker-compose structure) |\n| `netbox_image` | `\"netboxcommunity/netbox:v4.1.11\"` | Netbox application image version |\n| `netbox_port` | `8081` | Host port to expose Netbox on |\n| `netbox_install_dir` | `\"/opt/netbox-docker\"` | Installation directory on target |\n| `netbox_superuser_name` | `\"admin\"` | Admin username |\n| `netbox_superuser_email` | `\"admin@example.com\"` | Admin email |",
        "span_id": "span-1-66672ec614d1"
      }
    }
  ],
  "change_type": "M",
  "document_path": "docs/guides/netbox-deployment.md",
  "kind": "candidate_discovery_result",
  "manifest_sha256": "4de3201a96a5adcf8ce3c36641f4ff36df5f88afab37c9b083153134a40d89ef",
  "previous_path": null,
  "reason": "analysis_completed",
  "revision": {
    "base": "982fa7794529fc41414d699a3615e4e4f4327c3b",
    "head": "923c4c5af47499cde36cabba0fabdd9050c63aed"
  },
  "run_record_sha256": "a2b265a9a1bafbad06aa69187627c6b54ac20fce85e42bffc31ab0372d78422a",
  "schema_version": 2,
  "status": "completed"
}
