{"candidate_count": 1, "candidates": [{"classification": "candidate_contradiction", "edit": null, "evidence_refs": ["service.qwen3-tts.vllm-image"], "hunk_id": "hunk-1-f5ef6670e94d", "id": "qwen3-tts-vllm-image-mismatch", "reason": "evidence_conflict", "source": {"quote": "\u4ee5\u4e0b\u53d6\u503c\u7531 `tools/check-doc-claims.py` \u5bf9\u7167\u4ed3\u5e93\u4e2d\u7684\u5b9e\u9645\u914d\u7f6e\u6821\u9a8c\uff0c\u6539\u52a8\u5176\u4e00\u800c\u4e0d\u6539\u53e6\u4e00\u4f1a\u4f7f\u68c0\u67e5\u5931\u8d25\u3002\n\n```yaml\nqwen3_tts_vllm_image: \"vllm/vllm-omni:v0.28.1\"\nqwen3_tts_gpu_ordinal: 1\nqwen3_tts_port: 8100\nqwen3_tts_min_free_vram_mib: 512", "span_id": "span-1-482bd64386a1"}}], "change_type": "M", "document_path": "docs/designs/qwen3-tts-openai-api-integration.md", "kind": "candidate_discovery_result", "manifest_sha256": "ed1dde883ebab7d6126b92c8ae5391c3d60652294926b0361af92364cf9d9646", "previous_path": null, "reason": "analysis_completed", "revision": {"base": "982fa7794529fc41414d699a3615e4e4f4327c3b", "head": "e54118867dd994eb260a531ff3485c4319c7d22d"}, "run_record_sha256": "9a009ec0bec42536b853aa2994d2b862a155d800dd11890a95d3b4d3767441d5", "schema_version": 2, "status": "completed"}