{"candidate_count": 1, "candidates": [{"classification": "candidate_contradiction", "edit": null, "evidence_refs": ["service.qwen3-tts.min-free-vram-mib"], "hunk_id": "hunk-1-a66e5d995a46", "id": "cand-1-min-free-vram-mib", "reason": "evidence_conflict", "source": {"quote": "qwen3_tts_vllm_image: \"vllm/vllm-omni:v0.28.0\"\nqwen3_tts_gpu_ordinal: 1\nqwen3_tts_port: 8100\nqwen3_tts_min_free_vram_mib: 513\n```\n\n\u56db\u9879\u5747\u53d6\u81ea `ansible/roles/qwen3-tts/defaults/main.yml`\u3002", "span_id": "span-1-3c7e59d644ec"}}], "change_type": "M", "document_path": "docs/designs/qwen3-tts-openai-api-integration.md", "kind": "candidate_discovery_result", "manifest_sha256": "b29df82c38ccd0c27be88c6548faebd238b8ed0fe57600e638e4f2a42d2cb9c4", "previous_path": null, "reason": "analysis_completed", "revision": {"base": "982fa7794529fc41414d699a3615e4e4f4327c3b", "head": "f1f94ac83cb62fa111c50d259c0973a47dfc50c6"}, "run_record_sha256": "9fd6682664b620091271c1cdaedc764fed78f6cda027dc1d4a21ab78f1418b81", "schema_version": 2, "status": "completed"}