{
  "candidate_count": 1,
  "candidates": [
    {
      "classification": "candidate_contradiction",
      "edit": null,
      "evidence_refs": [
        "service.netbox.image"
      ],
      "hunk_id": "hunk-1-b7f31337c6fc",
      "id": "cand-netbox-image-001",
      "reason": "evidence_conflict",
      "source": {
        "quote": "| Variable | Default | Description |\n|----------|---------|-------------|\n| `netbox_git_version` | `\"3.0.2\"` | netbox-docker version (controls docker-compose structure) |\n| `netbox_image` | `\"netboxcommunity/netbox:v4.1.12\"` | Netbox application image version |\n| `netbox_port` | `8080` | Host port to expose Netbox on |\n| `netbox_install_dir` | `\"/opt/netbox-docker\"` | Installation directory on target |\n| `netbox_superuser_name` | `\"admin\"` | Admin username |",
        "span_id": "span-1-996dacc92a70"
      }
    }
  ],
  "change_type": "M",
  "document_path": "docs/guides/netbox-deployment.md",
  "kind": "candidate_discovery_result",
  "manifest_sha256": "7030f49632d0fbb4a5ec4a3dd4899b082ae73f42df262a3ef73890dd0f67f2c9",
  "previous_path": null,
  "reason": "analysis_completed",
  "revision": {
    "base": "982fa7794529fc41414d699a3615e4e4f4327c3b",
    "head": "301457e83b705b0d310f46c382b3bbe6b1e5b556"
  },
  "run_record_sha256": "6d07e85e8997fa750038e0183ee0f7eeda615612055ab8769215a049442b5371",
  "schema_version": 2,
  "status": "completed"
}
