{"candidate_count": 1, "candidates": [{"classification": "candidate_contradiction", "edit": null, "evidence_refs": ["service.qwen3-tts.port"], "hunk_id": "hunk-1-37e0c925a262", "id": "cand-qwen3-tts-port", "reason": "evidence_conflict", "source": {"quote": "```yaml\nqwen3_tts_vllm_image: \"vllm/vllm-omni:v0.28.0\"\nqwen3_tts_gpu_ordinal: 1\nqwen3_tts_port: 8101\nqwen3_tts_min_free_vram_mib: 512\n```\n", "span_id": "span-1-6ab2aa4ce103"}}], "change_type": "M", "document_path": "docs/designs/qwen3-tts-openai-api-integration.md", "kind": "candidate_discovery_result", "manifest_sha256": "486af1d390b9acd8de4fe827439975d9e198f8eef03980d4a690b2a282770229", "previous_path": null, "reason": "analysis_completed", "revision": {"base": "982fa7794529fc41414d699a3615e4e4f4327c3b", "head": "e341f85e13ace0a3d8def21e78af50bbe2a80057"}, "run_record_sha256": "9662922241eb7116e39157430c9e0b9409046eb93c785f31d214346c211da619", "schema_version": 2, "status": "completed"}